Title,Price,Price Range
NEW LISTINGDesign Patterns Elements of Reusable ObjectOriented Software,13.0,Low
NEW LISTINGHeal Your Headache  The 123 Program for Taking Charge of Your Pain by,9.95,Low
NEW LISTINGReach for Reading Common Core Program Grade K Volume 1 Units 14 Practice,25.0,Medium
NEW LISTINGMADONNA THE GIRLIE SHOW TOUR PROGRAM USA 1993 DITA MASK  ICON FAN CLUB LEAFLET,95.0,High
Healthy Brain Happy Life A Personal Program to to Activate Your Brain and D,14.56,Low
Workbook The Silva Mind Control Method The Revolutionary Program by the Founder,11.99,Low
NEW LISTINGNEW Python Programming An Introduction to Computer Science  John Zelle 2nd Ed,14.0,Low
NEW LISTINGTaylor Swift The Red Tour Official Concert Program Book Poster Inside,40.0,Medium
The C Programming Language Still Available by Stroustrup Bjarne,5.16,Low
Linux Programming Bible by Goerzen John,6.25,Low
